{"jobname": "Senior / E&M Engineer - Plumbing and Drainage (Ref: JD\\SEME\\EME - P&D)", "comname": "Build King Holdings Ltd", "img": "", "place": "", "salary": "Salary provided", "posttime": "Posted on 29 Aug 2020", "job_detail": "Job Highlights\nHD or above in BS, ME or related disciplines\n5 years relevant experience\nSkilled in Autocad is a must\nJob Description\nJob Description\n\n\n\n\nDesign of Plant room and pipe work layout drawing \nSite installation coordination with subcontractor and resident engineer \nStatutory submission and Inspection of WWO46 \n\n\n \nJob Requirement\n\n\n\n\n\n\nHD or above in Building Services / Mechanical Engineering or related disciplines\n\n\n5 years relevant experience in E&M / building services coordination / installation\n\nGood command of spoken and written English and Chinese \nGood communication skills \nSkilled in Autocad is a must. \nCandidates with more experience / academic qualification will be considered as Senior E&M Engineer\n\n\n\n\nPlease send your application with full resume and expected salary to \nHuman Resources Department, Units 601-605A, 6/F, Tower B, Manulife Financial Centre, 223 Wai Yip Street, Kwun Tong,\n Kowloon, Hong Kong\n (\nPlease quote the job reference number and job title on the subject)\n\n\nor by clicking \nJob Application\n \nor \n\"APPLY\n NOW\"\n.\n\n\n\nPlease visit our website \nwww.buildking.hk\n for more details.\n\n\n\n\n(Personal data collected will be used for recruitment-related purposes only.)\nAdditional Information\nCareer Level\nMiddle\nQualification\nNon-Degree Tertiary\nYears of Experience\nN/A\nJob Type\nFull Time, Permanent\nCompany Website\nhttp://www.buildking.hk/\nJob Functions\nEngineering\n > \nEngineering Project Management\n, \nEngineering\n > \nMechanical\n, \nBuilding & Construction\n > \nOthers\nCompany Overview\nINTEGRAL E&M ENGINEERING LIMITED\n is a rapidly expanded E&M contracting company which is one of the subsidiary companies in \nBuild King Holdings Limited\n (the Public Listed Company in the main board and one\n of the leading construction groups in Hong Kong). To cope with our business growth, we invite applications for following post.\nAdditional Company Information\nIndustry\nEngineering - Building, Civil, Construction / Quantity Survey\nBenefits & Others\nDental insurance\n, \nLife insurance\n, \nMedical insurance\n, \nPerformance bonus", "page": 7, "job_url": "https://hk.jobsdb.com/hk/en/job/senior-e-and-m-engineer-plumbing-and-drainage-100003007943146?searchRequestToken=4400150d-e0e5-47dc-97f5-ce3586835c5c&sectionRank=210&jobId=100003007943146"}
{"jobname": "English Teachers / Tutors (Full Time Only)", "comname": "Innovative English Education Centre", "img": "https://content.jobsdbcdn.com/Content/CmsContent/Logo/HK/JobsDBFiles/CompanyLogo/logo-x/51086x.png", "place": "Shatin Area", "salary": "Salary negotiable", "posttime": "Posted on 29 Aug 2020", "job_detail": "Job Highlights\nExperience living in  England is a must\nTo advance and develop curricula\nFresh Graduates are welcome\nJob Description\nKey Responsibilities:\n\n\n\n\n\n\nTo conduct English Lessons for Primary and Secondary Students\n\n\n\n\nTo attend trainings as required by the management\n\n\n\n\nTo advance and develop curricula\n\n\n\n\nTo enhance the quality of our teachers\n\n\n\n\n\n\nRequirements:\n\n \n\n\n\n\n\n\nExperience living in  England is a must\n\n\n\n\nDegree holder is preferred\n\n\n\n\nHigh proficiency\n in English \n(Native Level Of Speaking English is preferred)\n\n\n\n\nS\nolid\n experience in teaching children in small group is a plus\n\n\n\n\n\n\nResponsible, motivated and cheerful with genuine passion for teaching children\n\n\n\n\n\n\nBe able to connect with students and have good classroom management skills.\n\n\n\n\n\n\nGood interpersonal and communication skill\n\n\n\n\n\n5 1/2 days\n work including Saturday and / or Sunda\ny\n\n\n\n\nThose with less experience can apply for teaching\n assistant\n\n\n\n\nHave a Hong Kong permanent ID, a dependant visa, or a current employment\n visa\n\n\n\n\nCan understand Cantonese and Putonghua is sure\n an advantage\n\n\n\n\nPrior teaching experience is preferred\n\n\n\n\nFresh Graduates are welcome\n\n\n\n\nWe arrange and sponsor\n full time teachers with HK Work Visas\n\n\n\n\nThe Future:\n\n\n\n\n\n\nCandidate for management positions within Hong Kong or maybe Mainland China.\n\n\n\n\nBenefits:\n\n\n\n\n\n\nOT Pay\n\n\n\n\n\nFull training provided\n\n\n\n\n\n\n\nAttractive salary with good career prospects and remuneration package will\n be offered to the right candidate. Interested parties, please provide us your full resume with public exam results, present and expected salary.\n Please visit our website:\n\nhttp://www.iee.edu.hk\n  \nfor further information\n about IEE.\nAdditional Information\nCareer Level\nMiddle\nQualification\nNot Specified\nYears of Experience\nNot Specified\nJob Type\nFull Time\nJob Functions\nEducation\n > \nTeacher\n, \nEducation\n > \nTutor / Instructor\n, \nEducation\n > \nOthers\nCompany Overview\n\n\nInnovative English Education Centre (IEE)\n \nis\n a renowned learning centre in Shatin specialising in providing quality primary and secondary English Teaching.\nWe are dedicated to deliver the best educational products and services to community around Hong Kong.\nWe are now expanding and\nlooking for quality employees to join our team. If you want to compete in this fast growing\n marketplace in Hong Kong, join IEE today.\nAdditional Company Information\nIndustry\nEducation\nBenefits & Others\nOvertime pay", "page": 8, "job_url": "https://hk.jobsdb.com/hk/en/job/english-teachers-tutors-100003007943135?searchRequestToken=29955114-fbc7-450d-916a-4a779d401249&sectionRank=211&jobId=100003007943135"}
{"jobname": "Assistant Engineer - Civil / Foundation (Ref:JD/AE)", "comname": "Build King Holdings Ltd", "img": "", "place": "Tung Chung", "salary": "Salary provided", "posttime": "Posted on 29 Aug 2020", "job_detail": "Job Highlights\nDiploma or above in Civil Engg or equivalent\n1 year relevant experience \nimmediate available is preferred\nJob Description\n\n\nDiploma or above in Civil Engineering or related disciplines; \n1 year practical experience in construction \nGood communication skills; \nImmediate available is preferred. \n\n\n\n\n\nPlease send your application with full resume and expected salary to \nHuman Resources Department, Units 601-605A, 6/F, Tower B, Manulife\n Financial Centre, 223 Wai Yip Street, Kwun Tong, Kowloon, Hong Kong\n \n(please quote the job reference number and job title on the subject) \nor \nby\n clicking \nJob\n Application\n or \"\nAPPLY NOW\n\".\n\n\n\n\nPlease visit our website \nwww.buildking.hk\n for\n more details.\n\n\n\n\n(Personal data collected will be used for recruitment-related purposes only.)\nAdditional Information\nCareer Level\nEntry Level\nQualification\nNon-Degree Tertiary\nYears of Experience\nN/A\nJob Type\nFull Time, Permanent\nCompany Website\nhttp://www.buildking.hk/\nJob Functions\nBuilding & Construction\n > \nBuilding / Construction / QS\n, \nBuilding & Construction\n > \nCivil / Structural\nCompany Overview\nBUILD KING HOLDINGS LIMITED\n is the Public Listed Company in the main board and we are one of the leading construction groups in Hong Kong.  To cope with our business growth, we invite applications for:\nAdditional Company Information\nIndustry\nEngineering - Building, Civil, Construction / Quantity Survey\nBenefits & Others\nDental insurance\n, \nLife insurance\n, \nMedical insurance\n, \nPerformance bonus", "page": 8, "job_url": "https://hk.jobsdb.com/hk/en/job/assistant-engineer-civil-foundation-100003007943147?searchRequestToken=29955114-fbc7-450d-916a-4a779d401249&sectionRank=212&jobId=100003007943147"}
{"jobname": "Senior / E&M Engineer - Plumbing and Drainage (Ref: JD\\SEME\\EME - P&D)", "comname": "Build King Holdings Ltd", "img": "", "place": "", "salary": "Salary provided", "posttime": "Posted on 29 Aug 2020", "job_detail": "Job Highlights\nHD or above in BS, ME or related disciplines\n5 years relevant experience\nSkilled in Autocad is a must\nJob Description\nJob Description\n\n\n\n\nDesign of Plant room and pipe work layout drawing \nSite installation coordination with subcontractor and resident engineer \nStatutory submission and Inspection of WWO46 \n\n\n \nJob Requirement\n\n\n\n\n\n\nHD or above in Building Services / Mechanical Engineering or related disciplines\n\n\n5 years relevant experience in E&M / building services coordination / installation\n\nGood command of spoken and written English and Chinese \nGood communication skills \nSkilled in Autocad is a must. \nCandidates with more experience / academic qualification will be considered as Senior E&M Engineer\n\n\n\n\nPlease send your application with full resume and expected salary to \nHuman Resources Department, Units 601-605A, 6/F, Tower B, Manulife Financial Centre, 223 Wai Yip Street, Kwun Tong,\n Kowloon, Hong Kong\n (\nPlease quote the job reference number and job title on the subject)\n\n\nor by clicking \nJob Application\n \nor \n\"APPLY\n NOW\"\n.\n\n\n\nPlease visit our website \nwww.buildking.hk\n for more details.\n\n\n\n\n(Personal data collected will be used for recruitment-related purposes only.)\nAdditional Information\nCareer Level\nMiddle\nQualification\nNon-Degree Tertiary\nYears of Experience\nN/A\nJob Type\nFull Time, Permanent\nCompany Website\nhttp://www.buildking.hk/\nJob Functions\nEngineering\n > \nEngineering Project Management\n, \nEngineering\n > \nMechanical\n, \nBuilding & Construction\n > \nOthers\nCompany Overview\nINTEGRAL E&M ENGINEERING LIMITED\n is a rapidly expanded E&M contracting company which is one of the subsidiary companies in \nBuild King Holdings Limited\n (the Public Listed Company in the main board and one\n of the leading construction groups in Hong Kong). To cope with our business growth, we invite applications for following post.\nAdditional Company Information\nIndustry\nEngineering - Building, Civil, Construction / Quantity Survey\nBenefits & Others\nDental insurance\n, \nLife insurance\n, \nMedical insurance\n, \nPerformance bonus", "page": 8, "job_url": "https://hk.jobsdb.com/hk/en/job/senior-e-and-m-engineer-plumbing-and-drainage-100003007943146?searchRequestToken=29955114-fbc7-450d-916a-4a779d401249&sectionRank=213&jobId=100003007943146"}
{"jobname": "Accountant (Ref.:JD/AC)", "comname": "Build King Holdings Ltd", "img": "", "place": "Kwun Tong", "salary": "Salary provided", "posttime": "Posted on 29 Aug 2020", "job_detail": "Job Highlights\nHD in Accounting or related disciplines\nExperience using Flex System\nMinimum 2 years’ relevant exp in construction site\nJob Description\nResponsibilities :\n \n\n\n\n\n\n\nWork and oversee daily operations in construction site\n\n\nCompile management reports\n\nPerform financial analysis for management review\n\n\nPrepare annual budget\n\n\n\n\n\nRequirements :\n \n\n\n\n\n\n\nHigher Diploma or above in Accounting or related disciplines\n\n\n\n\n\nMinimum 2 years’ relevant experience in construction site preferably\n\n\n\n\nProficient in MS office application, especially MS Excel and Chinese Word Processing\n\n\n\n\n\nExperience in using Flex System\n\n\n\n\nExcellent communication and analytical skills\n\n\n\n\nSelf-initiative, detail-minded, team player and able to work independently\n\n\n\n\n\n\nPlease send your application with full resume and expected salary to \nHuman Resources Department,\nUnits 601-605A, 6/F, Tower B, Manulife Financial Centre, 223 Wai Yip Street, Kwun Tong, Kowloon, Hong Kong or click \"\nAPPLY\n NOW\n\"\n.\n \n \n(Please quote the job reference number and job title on the subject)\n\n\nPlease visit our website \nwww.buildking.hk\n for more details.\n\n\n(Personal data collected will be used for recruitment-related purposes only.)\nAdditional Information\nCareer Level\nMiddle\nQualification\nNon-Degree Tertiary\nYears of Experience\n2 years\nJob Type\nFull Time, Permanent\nCompany Website\nhttp://www.buildking.hk/\nJob Functions\nAccounting\n > \nAccountant\n, \nBuilding & Construction\n > \nBuilding / Construction / QS\nCompany Overview\nBUILD KING HOLDINGS LIMITED\n is the Public Listed Company in the main board and we are one of the leading construction groups in Hong Kong.  To cope with our business growth, we invite applications for:\nAdditional Company Information\nIndustry\nEngineering - Building, Civil, Construction / Quantity Survey\nBenefits & Others\nDental insurance\n, \nFree shuttle bus\n, \nLife insurance\n, \nMedical insurance\n, \nPerformance bonus", "page": 8, "job_url": "https://hk.jobsdb.com/hk/en/job/accountant-100003007943145?searchRequestToken=29955114-fbc7-450d-916a-4a779d401249&sectionRank=214&jobId=100003007943145"}
{"jobname": "Senior / Project Coordinator / Assistant Project Coordinator - Building (Ref: JD/PC/BLDG)", "comname": "Build King Holdings Ltd", "img": "", "place": "", "salary": "Salary provided", "posttime": "Posted on 29 Aug 2020", "job_detail": "Job Highlights\nDegree or Diploma in Building/Civil Eng\nat least 1 year site construction work exp\nSolid experience in project planning\nJob Description\nJob Description\n\n\n\n\nMonitor the progress, the standard of workmanship and efficiency of material usage adhered to the set target by carrying out site supervision.\n\n\nSupervise sub-contract or direct works, and making proposals for improvements in time and cost control.\n\n\nLiaise with relevant external and internal parties in respect of materials, construction sequences, drawing, methods and interfaces to ensure smooth running of the project.\n\n\nAssist in formulating construction plan and methods.\n\n\nReview / monitor design drawings, shop drawings, method statement and material submissions to meet the contractual requirements and achieve timely completion of the project within budget.\n\n\nAssist in carrying out safety and environmental control.\n\n\nEnsure all assigned responsibilities relating to quality are carried out in accordance with the Company quality procedures.\n\n\n\n\nJob Requirement\n\n\n\n\nDegree or Diploma in Building / Civil Engineering / Construction Management or related disciplines\n\n\nat least 1 year site construction work experience\n\n\nSolid experience in project planning and works coordination\n\n\nGood coordination and communication skills\n\n\nHard working, self-motivated and able to work independently\n\n\nImmediate available is preferred\n \nCandidate with more experience will be considered as Senior Project Coordinator or Project Coordinator \n\n\n\n\n\n\n\nPlease send your application with full resume and expected salary to \nHuman\n Resources Department, Units 601-605A, 6/F, Tower B, Manulife Financial Centre, 223 Wai Yip Street, Kwun Tong, Kowloon, Hong Kong\n \n(please\n quote the job reference number and job title on the subject) \nor \nby clicking \nJob\n Application\n or \"\nAPPLY NOW\n\".\n\n\n\n\n\nPlease visit our website\n www.buildking.hk\n \nfor more details.\n\n\n\n\n(Personal data collected will be used for recruitment-related purposes only.)\nAdditional Information\nCareer Level\nMiddle\nQualification\nNon-Degree Tertiary\nYears of Experience\n1 year\nJob Type\nFull Time, Permanent\nCompany Website\nhttp://www.buildking.hk/\nJob Functions\nBuilding & Construction\n > \nBuilding / Construction / QS\n, \nBuilding & Construction\n > \nCivil / Structural\n, \nEngineering\n > \nEngineering Project Management\nCompany Overview\nBUILD KING HOLDINGS LIMITED\n is one of the leading construction groups in Hong Kong.  To cope with our business growth, we invite applications for:\nAdditional Company Information\nIndustry\nEngineering - Building, Civil, Construction / Quantity Survey\nBenefits & Others\nDental insurance\n, \nLife insurance\n, \nMedical insurance\n, \nPerformance bonus", "page": 8, "job_url": "https://hk.jobsdb.com/hk/en/job/senior-project-coordinator-assistant-project-coordinator-building-100003007943144?searchRequestToken=29955114-fbc7-450d-916a-4a779d401249&sectionRank=215&jobId=100003007943144"}
{"jobname": "Site Agent / General Foreman / Assistant Foreman - Building (Ref:JD/SA/GF/AF)", "comname": "Build King Holdings Ltd", "img": "", "place": "", "salary": "Salary negotiable", "posttime": "Posted on 29 Aug 2020", "job_detail": "Job Highlights\n1 yr exp in building projects\nQualified for TCP Grade T1 preferably;\nImmediate available is preferred.\nJob Description\n\n\nQualified for TCP Grade T1;\n\n\n8 years' relevant experience in Building projects;\n\n\nSelf-discipline and good communication skills;\n\n\nImmediate available is preferred;\n\n\nCandidates with less experience or without T1 certificate will be considered as Assistant Foreman.\n\n\n\n\n \n\n\nPlease send your application with full resume in Word format and expected salary to \nHuman Resources Department, Units 601-605A, 6/F, Tower B, Manulife Financial Centre, 223 Wai Yip\n Street, Kwun Tong, Kowloon, Hong Kong \n(please quote the job reference number and job title on the subject) \nor by clicking\n \nJob\n Application\n or \"\nAPPLY NOW.\n\n\nPlease visit our website \nwww.buildking.hk\n for more details.\n\n\n(Personal data collected will be used for recruitment-related purposes only.)\nAdditional Information\nCareer Level\nMiddle\nQualification\nSchool Certificate\nYears of Experience\n1 year\nJob Type\nFull Time, Permanent\nCompany Website\nhttp://www.buildking.hk/\nJob Functions\nBuilding & Construction\n > \nBuilding / Construction / QS\n, \nBuilding & Construction\n > \nCivil / Structural\n, \nEngineering\n > \nEngineering Project Management\nCompany Overview\nBUILD KING HOLDINGS LIMITED\n is the Public Listed Company in the main board and we are one of the leading construction groups in Hong Kong.  To cope with our business growth, we invite applications for:\nAdditional Company Information\nIndustry\nEngineering - Building, Civil, Construction / Quantity Survey\nBenefits & Others\nDental insurance\n, \nLife insurance\n, \nMedical insurance\n, \nOvertime pay", "page": 8, "job_url": "https://hk.jobsdb.com/hk/en/job/site-agent-general-foreman-assistant-foreman-building-100003007943143?searchRequestToken=29955114-fbc7-450d-916a-4a779d401249&sectionRank=216&jobId=100003007943143"}
{"jobname": "冷電/機電技術員 (E&M Technician / Assistant)  (Ref: JD/EMT)", "comname": "Build King Holdings Ltd", "img": "", "place": "", "salary": "Salary provided", "posttime": "Posted on 29 Aug 2020", "job_detail": "Job Highlights\n中三或以上, 如修畢機電/電工/冷氣工程文憑或證書課程更佳\n1年安裝冷氣/保養/維修/機電工程/屋宇設備/冷氣或其他設備等相關, 如有有關吊船經驗優先\n持有相關技工/技術員資格或A 級或以上電業工程人員註冊證明書更佳\nJob Description\n\n\n\n\n中三或以上，如修畢機電/電工/冷氣工程文憑或證書課程更佳\n\n\n\n\n持有相關技工/技術員資格或A 級或以上電業工程人員註冊證明書更佳\n\n\n\n\n最少具1年安裝冷氣/保養/維修/機電工程/屋宇設備/其他設備等相關經驗\n\n\n有保養/維修/操作吊船經驗優先\n \n\n\n\n\n應徵者可將個人履歷傳真至 2398 0042 / 按\n職位申請\n輸入資料 / 按\"Apply  Now\".\n\n\n\n\n\n\n* 所有收集資料只用作招聘用途。\nAdditional Information\nCareer Level\nEntry Level\nQualification\nForm 3\nYears of Experience\n1 year\nJob Type\nFull Time, Permanent\nCompany Website\nhttp://www.buildking.hk/\nJob Functions\nBuilding & Construction\n > \nBuilding / Construction / QS\n, \nEngineering\n > \nElectrical / Electronics\n, \nEngineering\n > \nMechanical\nCompany Overview\nINTEGRAL\n E&M ENGINEERING LIMITED\n is a rapidly expanded E&M contracting company which is one of the subsidiary companies in \nBuild King Holdings Limited\n (the Public Listed Company in the main board and one of the leading\n construction groups in Hong Kong). To cope with our business growth, we invite applications for following post.\n\n\n\n宏高機電工程有限公司\n為\n利基控股有限公司\n全資附屬公司，利基控股乃香港上市公司及著名大型工程集團。\n宏高機電工程有限公司\n專業承造政府及私人的大型機電項目和維修保養工程。\n\n\n為配合公司急速發展，現誠聘以下職位：\n\nAdditional Company Information\nIndustry\nEngineering - Building, Civil, Construction / Quantity Survey\nBenefits & Others\nDental insurance\n, \nLife insurance\n, \nMedical insurance\n, \nOvertime pay\n, \nPerformance bonus", "page": 8, "job_url": "https://hk.jobsdb.com/hk/en/job/%e5%86%b7%e9%9b%bb-%e6%a9%9f%e9%9b%bb%e6%8a%80%e8%a1%93%e5%93%a1-100003007943142?searchRequestToken=29955114-fbc7-450d-916a-4a779d401249&sectionRank=217&jobId=100003007943142"}
{"jobname": "E&M Manager / Assistant E&M Manager / Senior E&M Engineer - MVAC (Ref: JD\\EMM\\AEMM\\SEME - MVAC)", "comname": "Build King Holdings Ltd", "img": "", "place": "", "salary": "Salary provided", "posttime": "Posted on 29 Aug 2020", "job_detail": "Job Highlights\nHD or above in BS, ME, EL or related disciplines\nat least 10 years' experience in MVAC preferably\nimmediately available is preferably\nJob Description\n\n\n\n\nHD or above in Building Services / Mechanical / Electrical Engineering or related disciplines\n\n\nat least 10 years' relevant experience in E&M / building services coordination / installation gained from MVAC / E&M contracting company\n\nExcellent planning and organizing skills \nProven team leadership and contractual awareness \nGood command of spoken and written English and Chinese \nGood communication skills \nCandidates with more experience / academic qualification will be considered as E&M Manager\n\n\n\n\nPlease send your application with full resume and expected salary to \nHuman Resources Department, Units 601-605A, 6/F, Tower B, Manulife Financial Centre, 223 Wai Yip Street, Kwun Tong,\n Kowloon, Hong Kong\n (\nPlease quote the job reference number and job title on the subject)\n\n\nor by clicking \nJob Application\n \nor \n\"APPLY\n NOW\"\n.\n\n\n\nPlease visit our website \nwww.buildking.hk\n for more details.\n\n\n\n\n(Personal data collected will be used for recruitment-related purposes only.)\nAdditional Information\nCareer Level\nMiddle\nQualification\nNon-Degree Tertiary\nYears of Experience\n10 years\nJob Type\nFull Time, Permanent\nCompany Website\nhttp://www.buildking.hk/\nJob Functions\nEngineering\n > \nEngineering Project Management\n, \nEngineering\n > \nOthers\n, \nBuilding & Construction\n > \nOthers\nCompany Overview\nINTEGRAL E&M ENGINEERING LIMITED\n is a rapidly expanded E&M contracting company which is one of the subsidiary companies in \nBuild King Holdings Limited\n (the Public Listed Company in the main board and one\n of the leading construction groups in Hong Kong). To cope with our business growth, we invite applications for following post.\nAdditional Company Information\nIndustry\nEngineering - Building, Civil, Construction / Quantity Survey\nBenefits & Others\nDental insurance\n, \nLife insurance\n, \nMedical insurance\n, \nPerformance bonus", "page": 8, "job_url": "https://hk.jobsdb.com/hk/en/job/e-and-m-manager-assistant-e-and-m-manager-senior-e-and-m-engineer-mvac-100003007943141?searchRequestToken=29955114-fbc7-450d-916a-4a779d401249&sectionRank=218&jobId=100003007943141"}
