{"jobname": "\"URGENT\" SENIOR MANAGER / MANAGER Business Development (Executive Program, High Incentive Bonus)", "comname": "Company Confidential", "img": "", "place": "Others", "salary": "Salary provided", "posttime": "Posted on 29 Aug 2020", "job_detail": "Job Highlights\nProviding comprehensive benefits, training & bonus\nTo conduct financial portfolio review for clients \n3 years working experience, 5-day, 20 annual leave\nJob Description\nSPECIAL OFFER\n\n\n\n\nFast Track Executive Program in 6-12 months\n \nto\n management level\n \nInitial annual income approx. \nHK$350,000 to 600,000\n \nplus\n\nAttractive Commission\n\n\nPackage\n \nincluding monthly allowance, monthly bonus, annual performance bonus, management\n override and seasonal incentive\n \nComprehensive Training Programs \n(pre-employment and\n on-job) for achieving professional qualifications\n \n5-day Work with Bank Holidays & 20-day Annual Leave\n\n\nMedical & Life Insurance Benefits \nwith MPF/ORSO scheme,\n \nLow-interest\n Mortgage Loans\n \nCustomer base provided, convenient working environment and friendly corporate & team culture\n\n\nProviding comprehensive products with user-friendly online service platform for administrative supports\n\n\n\n\nJOB DESCRIPTION\n\n\n\n\nTo provide \nwealth management\n \n&\n\nfinancial planning\nadvices and\n\nservices for personal customers including\n \nprotection, investment, retirement planning and risk management\n\n\nTo provide \nprofessional financial services\n \nfor\n corporate clients on MPF service, group medical and corporate services\n \nTo conduct \nfinancial portfolio review \nfor\n clients regularly\n \nTo build up client base and maintain reliable \ncustomer relationship\n\n\nTo \nestablish business team \nand\n provide coaching to team members under proficient management\n \n\n\nREQUIREMENT\n\n\n\n\nTertiary education in any disciplines (Degree holder preferable) with HKID cardholder\n\n\nMin 3 years working experience with sales or customer service experience is an advantage\n\n(less experience/qualification will be considered as junior position)\n\n\nMature, self-motivated, energetic and outgoing plus relationship development approach\n\n\nD\netail-minded, good interpersonal skills and high level of accuracy\n\n\nWith positive attitude, willing to learn & share and enjoy teamwork environment\n\n\nFluent in Cantonese and English\n\n\nImmediate available is highly preferred\n\n\n\n\nInterested candidates please send your application with full resume to our HR manager\n\n\nemail:  \nclaudia_yn_chui @ manulife.com.hk\n or\n\n\ncontact: \nMiss Chui at 6039 3968 or 2919 3606\n \nfor\n an interview.\n\n\nOnly shortlisted candidates will be contacted. All personal data collected will be kept strictly confidential and will be used for recruitment purposes\n only.\n\n\nAdditional Information\nCareer Level\nMiddle\nQualification\nDegree\nYears of Experience\n3 years\nJob Type\nFull Time, Permanent\nJob Functions\nHospitality / F & B\n > \nHospitality / Hotel Services\n, \nMarketing / Public Relations\n > \nPublic Relations - Event Management\n, \nSales, CS & Business Devpt\n > \nSales - Sales Management\nCompany Overview\nManulife (International) Limited\n\n\n**URGENT**\nSenior Manager & Manager, Business\n Development\n\n\n(Management Program, High Incentive Bonus)  \n\n\nManulife\n is committed to providing professional\n financial planning and wealth management services in Hong Kong and China. Manulife was awarded\n\n“Hong Kong’s Best Company for Financial Planning Excellence”\n of the IFPHK Financial Planner Awards in 2007-2016 for 10 years.\n\nWe are the\n\nNo. 1 Market Leader of MPF service provider\n in Hong\n Kong.\n\n\nTo cope with our strategic expansion, we are now looking for energetic and high caliber individuals to join our team with\n comprehensive on-job training programs and professional coaching activities provided. In order to encourage the decision of potential manpower as our members, we are offering a \nFAST-TRACK\n MANAGEMENT PROGRAM \nfor 6-12 months\n\nto selected candidates\n\nwith attractive career prospect and advancement. \nAdditional Company Information\nIndustry\nInsurance / Pension Funding\nBenefits & Others\nFive-day work week\n, \nFlexible working hours\n, \nFree shuttle bus\n, \nLife insurance\n, \nMedical insurance\n, \nPerformance bonus", "page": 6, "job_url": "https://hk.jobsdb.com/hk/en/job/senior-manager-manager-business-development-100003007943227?searchRequestToken=eb1c238e-1e60-4ced-9cc7-de417f84bccf&sectionRank=151&jobId=100003007943227"}
{"jobname": "Business Executive Manager", "comname": "明銳財務策劃顧問公司", "img": "", "place": "Hung Hom", "salary": "Base salary + high commission", "posttime": "Posted on 29 Aug 2020", "job_detail": "Job Highlights\nSalary $12,000 - $50,000 + Commission + Bonus\nFlexible Working Hour\nFast-track Advancement & Overseas Conventions\nJob Description\nWe are young, energetic, and enthusiastic team, which seeks a breakthrough. Here we aim to enhance personal development and career achievement in balance, provide you with ongoing guidance that you need to be proactive, and take the steps needed to reach\n your personal goal.\n\n\n\n\n＊＊＊＊＊Let's get started！＊＊＊＊＊\n\n\n\n\n\n\n// Job Responsibilities //\n\n\n\n\n\n\n\n\nAnalyze the needs and provide the solution to the individual and corporate clients\n\n\nIntroduce our MPF proposition to potential clients and handling of the allocation and consolidation    \n\nManage and retain individual and corporate MPF accounts, in terms of developing the relationship with clients and review their portfolio periodically  \n\nProvide professional financial services to our clients, including retirement planning and wealth accumulation etc.\n\nLiaise effectively with external providers and internal teams for optimizing the customer service quality\n\nMaximize client satisfaction through customer service (including aftersales services), providing information about products and services\n\nManage corporate business accounts (including group benefits, like Group Medical and Office Insurance) and ad hoc business programs and activities\n\n\n\n// Package & Support //\n\n\n\n\n\n\nAllowance from $12,000 (Up to $50k) + attractive commission + monthly bonus \n$17,000 training allowance\n \nOn the job training will be provided (join field work) \nGood career prospects and fast track promotion program \n5 Days work week, MPF, medical insurance package, overseas conventions... \nComprehensive and continuous professional training programs \nFlexible working hours \nBrighterGen program for university graduate students \n\n\n// Requirements //\n\n\n\n\nDegree holder in any discipline or above \nFluent in Cantonese, moderate English \nWilling to learn and face challenges, aggressive, self-motivated with good learning attitude\n\nProactive, positive mindset, excellent interpersonal & communication skill \nFresh Graduate will be considered  \n\n\n\n\nInterested parties please send your CV to Mr. Wong by clicking \"Apply Now\" or contact Mr. Wong at 6308-1059 for more information.\n\n\nAll personal data will be used only for recruitment purposes only.\nAdditional Information\nCareer Level\nEntry Level\nQualification\nDegree\nYears of Experience\nNot Specified\nJob Type\nFull Time, Permanent\nJob Functions\nInsurance\n > \nInsurance Agent / Broker\n, \nMarketing / Public Relations\n > \nMarketing - Brand / Product Management\n, \nBanking / Finance\n > \nWealth Management\nCompany Overview\nWe are a young, energetic, and enterprising team with more than 170 people. We have been the best team in the company's MPF for five consecutive years.\n\n\n\nOur team focuses on the management of corporate MPF business, serving more than 1,000 large and small enterprises, with more than 30,000 employees, and is the confidence choice of major corporate employers.\n\n\n\nA culture of mutual assistance and win-win teamwork, through MPF business to bring you passive income, to help you have more ambitious development in certain areas.\nAdditional Company Information\nIndustry\nFinancial Services\nBenefits & Others\nEducation allowance\n, \nFive-day work week\n, \nFlexible working hours\n, \nLife insurance\n, \nMedical insurance\n, \nPerformance bonus\n, \nTravel allowance\n, \nWork from home", "page": 6, "job_url": "https://hk.jobsdb.com/hk/en/job/business-executive-manager-100003007943223?searchRequestToken=eb1c238e-1e60-4ced-9cc7-de417f84bccf&sectionRank=152&jobId=100003007943223"}
{"jobname": "倉務文員 Warehouse Clerk", "comname": "Powertek Group Co., Limited", "img": "", "place": "Kwun Tong", "salary": "HK$11,000 - HK$14,000 /month ", "posttime": "Posted on 29 Aug 2020", "job_detail": "Job Highlights\n中五或以上程度，良好粵語，普通話 & 一般英語\n良好電腦 & MS Office 操作，懂中英文打字，懂Tradelink進出口報關\n有2年或以上電子貿易經驗者優先\nJob Description\n< \n職責\n >\n\n\n進出貨物文件處理\n、資料輸入\n、\n電子報關\n、\n瑣碎雜\n務\n \n\n\n< \n要求\n >\n\n\n~ 中五或以上程度\n\n~ 良好粵語，普通話\n & \n一般\n英語\n\n~ \n懂讀寫中文\n & \n\n\n英文\n\n~ 良好\n電腦 & Microsoft Office 操作\n\n~ 懂Tradelink進出口報關\n\n~ \n有２年或以上電子貿易經驗\n\n\n~ 工作時間\n: 5\n天工作\n; 9am ~ 6pm\n\n\n~ 勤奮有責任心，刻苦耐勞，能獨立處理工\n作\n \n\n\n< \n待遇\n >\n\n\n~ 基本薪金\n : $14,000-\n\n\n~ 超時工作津貼\n\n~ \n每月獎金\n\n\n~ \n有薪年假\n\n\n~ \n有薪病\n假\n\n~ \n醫療津貼\n\n\n~ \n身體檢查\n\n~ 年終\n雙糧\n \nAdditional Information\nCareer Level\nEntry Level\nQualification\nSchool Certificate\nYears of Experience\n2 years\nJob Type\nFull Time\nJob Functions\nTransportation & Logistics\n > \nInventory / Warehousing\n, \nTransportation & Logistics\n > \nShipping\nAdditional Company Information\nIndustry\nTrading and Distribution\nBenefits & Others\nDouble pay\n, \nFive-day work week\n, \nMedical insurance\n, \nOvertime pay\n, \nPerformance bonus", "page": 6, "job_url": "https://hk.jobsdb.com/hk/en/job/%e5%80%89%e5%8b%99%e6%96%87%e5%93%a1-warehouse-clerk-100003007943222?searchRequestToken=eb1c238e-1e60-4ced-9cc7-de417f84bccf&sectionRank=153&jobId=100003007943222"}
{"jobname": "Consultant/ Trainee Solicitor/ Paralegal ", "comname": "Eva Kwok & Co., Solicitors", "img": "", "place": "Central", "salary": "Salary provided", "posttime": "Posted on 29 Aug 2020", "job_detail": "Job Highlights\nPCLL/LL.B Degree/ Litigation & Gd legal research \nChinese not must for English native; Work Permit \nMonthly Salary HKD14K or negotiable      \nJob Description\n\n\n\nWork on commercial transactions/contract drafting, intellectual property, litigation and various tasks as assigned by Principal; \n\n\n\n\nC\nonduct legal research/ prepare legal opinions\n\n\n\n\n\n           \n Requirements:\n \n\n\n\n\n\n\n\n\nPCCL and LLB for Assistant Solicitor/Trainee Solicitor\n\n\n\n\n\nLegal Dip for Paralegal\n\n\n\n\nChinese not a must for English native speaker\n\n\n\n\nMature, over 3 years litigation experience for paralegal\n\n\n\n\n\nGood written Chinese and English\n\n\n\n\nIndependent, honest, diligent, attention to details, and good team player\n\n\n\n\nGood PC skills (English/Chinese word processing)\n\n\n\n\nWork permit in HK a must\n\n\n\n\n             \nBenefits:\n\n\n\n\n\n\n\n\nSalary 14,000 or negotiable; \n\n\n\n\nPerformance/year end bonus\n\n\n\n\nAdvanced Medical Insurance Plan\n\n\n\n\n\n\n*Interested parties please send application letter with full CV, stating last salary and expected salary and availability to Ms. Kwok( previous applicants are\n welcome to re-apply) \n\n\n\n\n\n\n\nby clicking  \"Apply Now\".\n\n\nAdditional Information\nCareer Level\nMiddle\nQualification\n(N/A)\nYears of Experience\nN/A\nJob Type\nFull Time, Permanent\nJob Functions\nProfessional Services\n > \nLegal & Compliance\nCompany Overview\n\n\n\n\n\nWe are a friendly local firm with commercial, IP and litigation focus (5 days work week) located in the heart of Central. We cordially invite potential\n candidates to join our firm. Firm's website :  www.evaklawfirm.com \n\n\n\n\n\nAdditional Company Information\nIndustry\nLegal Services\nBenefits & Others\nDouble pay\n, \nFive-day work week\n, \nMedical insurance\n, \nPerformance bonus", "page": 6, "job_url": "https://hk.jobsdb.com/hk/en/job/consultant-trainee-solicitor-paralegal-100003007943207?searchRequestToken=eb1c238e-1e60-4ced-9cc7-de417f84bccf&sectionRank=154&jobId=100003007943207"}
{"jobname": "IT Officer", "comname": "Company Confidential", "img": "", "place": "Tsim Sha Tsui", "salary": "Salary negotiable", "posttime": "Posted on 29 Aug 2020", "job_detail": "Job Highlights\nIT officer manager, food and beverage, restaurant,\nhotel catering POS\nsoftware, hardware, Linus\nJob Description\nAn expanding F&B group looking for a high calibre  IT Officer\n\n\n\nWe offer a very competitive package for the RIGHT candidate.\n \n\n\n\n\nJob Responsibilities:\n\n\n\n\n\n\nResponsible for administration, monitoring, backup / recovery and patch management for servers, firewall and network equipment\n\nTroubleshoot, diagnose and solve hardware / software faults and coordinate with the vendors for hardware / software maintenance\n\nHandle various administrative duties and special tasks or projects as assigned\n\nProvide  technical support for IT issues during and beyond office hours \n\n\nThe Requirement\n\n\n\n\n\n\nTertiary education or above in Computer Sciences / Information Systems \nA minimum of 2 years’ IT infrastructure setup and administrative experience \nKnowledge and understanding of contemporary information technology \nDemonstrate experience in Microsoft Windows and Linux operating systems and cloud computing\n\nFamiliar with PC skill, hardware and network support \nExperience in  Food and Beverage and POS support is an advantage \nChinese; \nGood team player and able to work under pressure. \n\n\nInterested candidates, please contact us at 23143550 for company details before applying.\nAdditional Information\nCareer Level\nNot Specified\nQualification\nNot Specified\nYears of Experience\nNot Specified\nJob Type\nFull Time\nJob Functions\nHospitality / F & B\n > \nFood & Beverage\nAdditional Company Information\nIndustry\nFood and Beverage", "page": 6, "job_url": "https://hk.jobsdb.com/hk/en/job/it-officer-100003007943221?searchRequestToken=eb1c238e-1e60-4ced-9cc7-de417f84bccf&sectionRank=155&jobId=100003007943221"}
{"jobname": "(全職)課程統籌/高級課程統籌", "comname": "Christian Family Service Centre Jackie Chan Whole Person Development Centre", "img": "https://content.jobsdbcdn.com/Content/CmsContent/Logo/HK/JobsDBFiles/CompanyLogo/49812.png", "place": "Tseung Kwan O", "salary": "Salary negotiable", "posttime": "Posted on 29 Aug 2020", "job_detail": "Job Highlights\n(全職)課程統籌/高級課程統籌\nEDUCATION\nSOCIAL SERVICE\nJob Description\n職責：\n\n\nl\n課程統籌及行政工作，包括幼兒及兒童課程\n\n\nl\n教\n授\n幼兒及兒童班組\n\n\nl\n支援及推\n廣\n本中心活動\n\n\n條件：\n\n\n\n\n處事進取、良好溝通技巧\n \n獨立工作、富責任感及團隊精神\n \n大專或以上程度\n，須\n就讀幼兒教育、\n英文系、或特殊教育\n系\n\n\n須\n具\n半\n年或以上相關工作經驗\n，\n具統籌課程、\n補習社或\n教學經驗優先考慮\n\n\n良好電腦操作\n (MS Office)\n\n\n須輪班及外勤，將軍澳工作\n\n\n\n\n*\n經驗豐富者可作高級課程統籌考慮\n\n\n申請信連履歷、期望薪金、日間聯絡電話等電郵\n或郵寄至將軍澳景林鄰里社區中心一樓\n(\n\n網址\n : www.wholeperson.org.hk)\nAdditional Information\nCareer Level\nMiddle\nQualification\nDegree\nYears of Experience\n1 year\nJob Type\nFull Time\nJob Functions\nPublic / Civil\n > \nSocial Services - Community / Non-profit Organization\nAdditional Company Information\nIndustry\nCharity / Social Services / Non-Profit Organisation\nBenefits & Others\nMedical insurance", "page": 6, "job_url": "https://hk.jobsdb.com/hk/en/job/%e8%aa%b2%e7%a8%8b%e7%b5%b1%e7%b1%8c-%e9%ab%98%e7%b4%9a%e8%aa%b2%e7%a8%8b%e7%b5%b1%e7%b1%8c-100003007943219?searchRequestToken=eb1c238e-1e60-4ced-9cc7-de417f84bccf&sectionRank=156&jobId=100003007943219"}
{"jobname": "Assistant Security Officer (5-day work week & Double Pay)", "comname": "GIA Hong Kong Laboratory Limited", "img": "", "place": "Kowloon Bay", "salary": "Salary negotiable", "posttime": "Posted on 29 Aug 2020", "job_detail": "Job Highlights\n5-day work week\nDouble Pay \nMedical, Dental and Life Insurance\nJob Description\nCome work at the world’s most respected gemological laboratory as a Assistant Security Officer at GIA Hong Kong located in Kowloon Bay. This position\n is responsible\n for protecting the employees and properties of the laboratory from unsafe and/or threatening situations\n.\n\n\n\n\nRESPONSIBILITIES\n\n\n\n\n\n\nAssists in maintaining & updating security and safety manuals, procedures and records.\n\n\nAssists in implementing, following and enforcing all security and safety policies and procedures as directed and complies with all uniform and plain clothes assignments related to job as assigned.\n\n\nMonitors vendor, visitor, and client movement, their sign-in logs and ensures appropriate escorts.\n\n\nConducts periodic walking patrols in the lab and reports unusual activities/observations.\n\n\nMonitors CCTV and reports any unusual observations.\n\n\nPerforms daily reviews of CCTV live and recorded video and submits daily reports.\n\n\nAssists in operating and ensuring maintenance of the security technical systems.\n\n\nMaintains security related equipment, procedures and facilities.\n\n\nMaintains security log-books and records all significant activities during the duty hours.\n\n\nAssists management in incident investigations.\n\n\nInterfaces with GIA corporate security organization and building security management.\n\n\nAttends job-related training courses as directed.\n\n\nPerforms any other duties as may be assigned from time to time to meet the exigencies of GIA.\n\n\n\n\nREQUIREMENTS\n\n\n\n\nShould hold a valid “\nSecurity Personnel Permit\n”.\n\n\nMinimum of 2 - 3 years of security experience required and/or experience in a related field. \n\n\nValid Certifications in First Aid, Cardio-Pulmonary Resuscitation (CPR), and Automated External Defibrillation (AED) training are highly preferred.\n\n\nFurther\n certificates and/or licenses in security field preferred and/or a willingness to\n obtain the appropriate licenses/certificates and ongoing training as needed.\n\n\n\n\n  \n\n\n“\nWe are an equal opportunity employer and welcome applications from all qualified candidates.  Personal data provided by job applicants will be used strictly in accordance\n with our personal data policy. The information will only be used for appointment to the Company and other company-related purposes.”\n\n\nContact & Company Information\n\n\nPlease submit resumes by clicking APPLY NOW. All resumes must include your past salary history and current salary requirements. \n\n\nWe encourage you to visit our corporate website at\n\n\n\nwww.gia.edu\n to learn more information about GIA.\nAdditional Information\nCareer Level\nMiddle\nQualification\nSchool Certificate\nYears of Experience\n2 years\nJob Type\nFull Time, Permanent\nCompany Website\nhttp://www.gia.edu\nJob Functions\nProperty / Real Estate\n > \nProperty Management\n, \nProperty / Real Estate\n > \nOthers\n, \nOthers\n > \nSecurity / Safety Control\nCompany Overview\nAbout GIA \n\n\nEstablished in 1931, GIA is the world’s foremost authority on diamonds, colored stones, and pearls. GIA exists to protect all purchasers of gemstones, by providing the education, laboratory services, research and instruments\n needed to accurately and objectively determine gemstone quality. As creator of the 4Cs and the GIA International Diamond Grading System™, the Institute sets and maintains the standard for grading and identification practices used worldwide. GIA’s corporate\n headquarters are located in the United States in Carlsbad, California.\n\n\n\n\nAs the world’s most respected gemological laboratory, GIA is entrusted with grading and identifying more gems than any other lab, including famous diamonds like the Hope, the Taylor-Burton, the De Beers Millennium Star, and the\n Incomparable. Located in major gem and jewelry centers around the world, GIA laboratories are staffed by expert diamond graders and gemologists, whose work sets the standard for grading practices worldwide.\nAdditional Company Information\nIndustry\nOthers\nBenefits & Others\nDental insurance\n, \nDouble pay\n, \nFive-day work week\n, \nFree shuttle bus\n, \nLife insurance\n, \nMedical insurance\n, \nOvertime pay", "page": 6, "job_url": "https://hk.jobsdb.com/hk/en/job/assistant-security-officer-100003007943218?searchRequestToken=eb1c238e-1e60-4ced-9cc7-de417f84bccf&sectionRank=157&jobId=100003007943218"}
{"jobname": "Programmer/ Senior Programmer/ Web Developer", "comname": "Many Wells Property Agent Ltd", "img": "", "place": "Tuen Mun Area", "salary": "Salary provided", "posttime": "Posted on 29 Aug 2020", "job_detail": "Job Highlights\nDiscretionary Gratitude\nMaintain the company's Website and related Website\nFresh Graduates are welcome\nJob Description\nJob Responsibilities:\n\n\n\n\nMaintain the company's Website and related Websites Design & Contents  \nAssist in user requirement study, system analysis and design, implementation, testing and deployment\n\n\n\n Job Requirements:\n\n\n\n\nDiploma or above in Computer Science, I.T. or equivalent discipline \nKnowledge in PHP, Mysql, Javascript, C, Java, shell Script \nKnowledge in Linux will be an advantage \nHardworking and willing work under pressure \nSelf-motivated, strong problem solving and analytical skills \nGood communication skill in Chinese \nFresh Graduates are welcome\n\n\n\n\n\nInterested parties, please click \"Apply Now\" to submit your application.\n\n(All Personal information will be used for recruitment purpose only.)\nAdditional Information\nCareer Level\nEntry Level\nQualification\nNot Specified\nYears of Experience\nN/A\nJob Type\nFull Time\nCompany Website\nhttp://www.manywells.com.hk\nJob Functions\nInformation Technology (IT)\n > \nIT - Webmaster / SEO\n, \nInformation Technology (IT)\n > \nSoftware Development\n, \nInformation Technology (IT)\n > \nNetwork & System\nCompany Overview\nWe are the one of the largest property agency in Hong Kong. Now is a chance for you to brighten up your carreer.\nAdditional Company Information\nIndustry\nProperty Management / Consultancy", "page": 6, "job_url": "https://hk.jobsdb.com/hk/en/job/programmer-senior-programmer-web-developer-100003007943215?searchRequestToken=eb1c238e-1e60-4ced-9cc7-de417f84bccf&sectionRank=158&jobId=100003007943215"}
