{"jobname": "Project Manager", "comname": "Ming Hing Waterworks Engineering Co Ltd", "img": "https://content.jobsdbcdn.com/Content/CmsContent/Logo/HK/JobsDBFiles/CompanyLogo/1347.gif", "place": "", "salary": "Salary negotiable", "posttime": "Posted on 29 Aug 2020", "job_detail": "Job Highlights\nEnsure all projects meet clients & statutory req.\nDegree holder in Civil Engineering or equivalent\nNEC experience\nJob Description\nDuties & Responsibilities:\n\n\n\n\nEnsure all projects meet clients and statutory requirement\n\n\nLead project teams to complete the projects on schedule, within budget and at a high level of quality;\n\n\nParticipate in the preparation of tender documents and technical submissions;\n\n\nResponsible for contract administration;\n\n\nEnsure all company policies and plans are aligned to the broader group processes and systems;\n\n\nPerform other ad hoc duties as assigned\n\n\n\n\nRequirements:\n\n\n\n\nDegree holder in Civil Engineering or equivalent;\n\n\nProfessional memberships is a\n\nmust\n, such as MHKIE & MICE;\n \nAt least 15 years solid experience in civil works;\n\n\nFamiliar with NEC projects is desired;\n\n\nGood command of spoken and written English and Cantonese;\n\n\nCandidate with\n\nless\n experience would be considered as\n Assistant Project Manager\n\n\nImmediately available is highly preferred.\n\n\n\n\nBenefit:\n\n\nWe offer good career prospects, 5/ 6-day work (Alt. Sat), training sponsorship allowance, medical allowance and intensive discretionary bonus to the right candidates.\n\n\n\n\nWorking Hour       : Mon – Fri    08:00 – 18:00    Alt. Sat    08:00 – 18:00\n\n\nWork Location      : Site Office\n\n\nHoliday                 : Public Holiday\n\n\nAnnual Leave      : 16 days\n\n\nPaid Leave    : Birthday Leave/ Marriage Leave/ Maternity Leave/ Paternity Leave/ Compassionate Leave\n\n\n\n\nJob Application:\n\n\n\n\nPlease click \"Apply Now\" to submit your application.　\n\n\nApplication without expected salary will not be considered.\n\n\n\n\nPersonal Information Collection Statement:\n\n\n\n\nPersonal data provided to Ming Hing Waterworks group is solely for recruitment purposes. Your personal data may be transferred within the group\n for recruitment use only.\n \nMing Hing Waterworks group may disclose relevant data that applicants provided to the person(s) and organization(s) as stated for this recruitment\n purposes.\n \nTo update your personal data or to request for a copy after submission of job application form, please contact Human Resources Department at (852)\n 2380 8265 or e-mail by clicking \"Apply Now\".\n \nAdditional Information\nCareer Level\nSenior\nQualification\nDegree\nYears of Experience\n15 years\nJob Type\nFull Time, Permanent\nJob Functions\nBuilding & Construction\n > \nBuilding / Construction / QS\n, \nBuilding & Construction\n > \nCivil / Structural\n, \nEngineering\n > \nEngineering Project Management\nCompany Overview\nMing Hing Waterworks Engineering Co., Ltd is a premium integrated waterworks engineering, technology and investment company. The Group principally engages in\n the provision of project management services, maintenance and construction works for civil engineering projects on waterworks & drainage, roads & highways and slope upgrading services in Hong Kong. Founded in 1967, the Group has grown to establish itself as\n a major waterworks engineering service provider in Hong Kong, accountable for ensuring dependable water supply to the community.\n\n\n\nGiven increasing project work in Hong Kong and China, Ming Hing is inviting high calibre applicants for the following positions to join its present team of professionals.\nAdditional Company Information\nIndustry\nEngineering - Building, Civil, Construction / Quantity Survey\nBenefits & Others\nEducation allowance\n, \nPerformance bonus", "page": 7, "job_url": "https://hk.jobsdb.com/hk/en/job/project-manager-100003007943185?searchRequestToken=4400150d-e0e5-47dc-97f5-ce3586835c5c&sectionRank=181&jobId=100003007943185"}
{"jobname": "Programme Manager", "comname": "Ming Hing Waterworks Engineering Co Ltd", "img": "https://content.jobsdbcdn.com/Content/CmsContent/Logo/HK/JobsDBFiles/CompanyLogo/1347.gif", "place": "", "salary": "Salary negotiable", "posttime": "Posted on 29 Aug 2020", "job_detail": "Job Highlights\nHaving Professional Membership, e.g. MHKIE or MICE\n10 years post degree experience in construction \n1 year of proven experience in NEC Contracts\nJob Description\nDuties & Responsibilities:\n\n\n\n\nResponsible for the planning, scheduling and programme development of construction activities;\n\n\nReview, monitor and report actual progress against project programme;\n\n\nIdentify risks and opportunities with mitigation strategies to maintain key project milestones and completion date;\n\n\nLiaise with clients, government authorities and external parties to solve problems; and\n\n\nPerform other ad hoc assignments as assigned.\n\n\n\n\nRequirements:\n\n\n\n\nDegree holder in Civil Engineering or equivalent;\n\n\nHaving Professional Membership, such as MHKIE or MICE;\n\n\n10\n\nyears post degree experience in construction contracts, among which at least 5 years’ experience in programme management\n;\n\n\n1 year of proven experience in the use of NEC Contracts or be Accredit NEC3 or NEC4 EEC Project Manager;\n\n\nHolder of driving license is a MUST;\n\n\nGood command of spoken and written English and Cantonese.\n\n\n\n\nBenefit:\n\n\nWe offer good career prospects, 6-day work (Alt. Sat), training sponsorship allowance, medical allowance to the right candidates.\n\n\nWorking Hour      :      Mon – Sat (Alt. Sat) 08:00 – 18:00\n\n\nHoliday                :      Public Holiday\n\n\nAnnual Leave      :      16 days\n\n\nPaid Leave          :    Birthday Leave/ Marriage Leave/ Maternity Leave/ Paternity Leave/ Compassionate Leave\n\n\nJob Application:\n\n\n\n\nPlease click \"Apply Now\" to submit your application\n.\n　\n\n\nApplication without expected salary will not be considered.\n\n\n\n\n \nPersonal Information Collection Statement:\n\n\n\n\nPersonal data provided to Ming Hing Waterworks\n\ngroup \nis solely for recruitment purposes. Your personal data may be transferred within the group for recruitment use only.\n\n\nMing Hing Waterworks group\n\nmay\n disclose relevant data that\n\napplicants\n provided to the person(s) and organization(s) as stated for this\n\nrecruitment purposes.\n \nTo update your personal data or to request for a copy after submission of job application form, please contact Human Resources Department at (852) 2380 8265 or e-mail\n by clicking \"Apply Now\".\n \nAdditional Information\nCareer Level\nSenior\nQualification\nDegree\nYears of Experience\n10 years\nJob Type\nFull Time, Permanent\nJob Functions\nBuilding & Construction\n > \nCivil / Structural\n, \nEngineering\n > \nEngineering Project Management\nCompany Overview\nMing Hing Waterworks Engineering Co., Ltd is a premium integrated waterworks engineering, technology and investment company. The Group principally\n engages in the provision of project management services, maintenance and construction works for civil engineering projects on waterworks & drainage, roads & highways and slope upgrading services in Hong Kong. Founded in 1967, the Group has grown to establish\n itself as a major waterworks engineering service provider in Hong Kong, accountable for ensuring dependable water supply to the community.\n\n\n\nGiven increasing project work in Hong Kong and China, Ming Hing is inviting high calibre applicants for the following positions to join its present team of professionals.\nAdditional Company Information\nIndustry\nEngineering - Building, Civil, Construction / Quantity Survey\nBenefits & Others\nEducation allowance\n, \nMedical insurance\n, \nPerformance bonus", "page": 7, "job_url": "https://hk.jobsdb.com/hk/en/job/programme-manager-100003007943184?searchRequestToken=4400150d-e0e5-47dc-97f5-ce3586835c5c&sectionRank=182&jobId=100003007943184"}
{"jobname": "Construction Manager/ Site Agent/ Works Manager", "comname": "Ming Hing Waterworks Engineering Co Ltd", "img": "https://content.jobsdbcdn.com/Content/CmsContent/Logo/HK/JobsDBFiles/CompanyLogo/1347.gif", "place": "", "salary": "Salary negotiable", "posttime": "Posted on 29 Aug 2020", "job_detail": "Job Highlights\nLead project teams to complete the projects \n15-20 years solid experience in civil engineering\nFamiliar with NEC Project Requirements\nJob Description\nDuties & Responsibilities:\n\n\n\n\nEnsure all projects meet clients and statutory requirement; \nLead project teams to complete the projects on schedule, within budget and at a high level of quality; \n\nParticipate in the preparation of tender documents and technical submissions;\n\nResponsible for contract administration; \nEnsure all company policies and plans are aligned to the broader group processes and systems;\n\nPerform other ad hoc duties as assigned. \n\n\nRequirements:\n\n\n\n\nDegree in Civil Engineering or related disciplines; \nMHKIE or equivalent in Civil discipline with NEC experience for Construction Manager and Site Agent;\n\nFor Construction Manager, Applicant should have at least 20 years post professional qualification experience in civil engineering construction management and planning, contract administration, site coordination and control, among which at least 10 years\n management experience with main contractor and 1 year proven experience as construction manager or site agent in use of NEC or accredited NEC project manager.\n\nFor Site Agent, Applicant should have at least 15 years post professional qualification, among which 5 years in management position and 10 years in water or wastewater works of which 2 years in laying large diameter steel water mains (DN 600 or larger)\n and 5 years in temporary traffic management and 1 year proven experience as construction manager or site agent in use of NEC or accredited NEC project manager.\n\nFor Works Manager, , Applicant should have at least 15 years post degree experience, among which 10 years in mains laying works, of which 2 years in laying large diameter steel water mains (DN600 or larger)\n\nGood command of spoken and written English and Cantonese; \nImmediately available is highly preferred. \n\n\nBenefit:\n\nWe offer good career prospects,6-day work (Alt. Sat), training sponsorship allowance, medical allowance and intensive discretionary bonus to the right candidates. \n\n\n\n\nWorking Hour   : Mon – Sat (Alt Sat)    08:00 – 18:00 \nWork Location  : Site Office \nHoliday              : Public Holiday \nAnnual Leave   : 14 -16 days \nPaid Leave        :Birthday Leave/ Marriage Leave/ Maternity Leave/ Paternity Leave/ Compassionate Leave\n\n\n\nJob Application:\n\n\n\n\nPlease click \"Apply Now\" to submit your application.　 \nApplication without expected salary will not be considered. \n\n\nPersonal Information Collection Statement:\n\n\n\n\nPersonal data provided to Ming Hing Waterworks group is solely for recruitment purposes. Your personal data may be transferred within the group for recruitment use only.\n\nMing Hing Waterworks group may disclose relevant data that applicants provided to the person(s) and organization(s) as stated for this recruitment purposes.\n\nTo update your personal data or to request for a copy after submission of job application form, please contact Human Resources Department at (852) 2380 8265 or e-mail by clicking \"Apply Now\".\n\nAdditional Information\nCareer Level\nSenior\nQualification\nDegree\nYears of Experience\n15 years\nJob Type\nFull Time, Permanent\nJob Functions\nBuilding & Construction\n > \nBuilding / Construction / QS\n, \nBuilding & Construction\n > \nCivil / Structural\n, \nEngineering\n > \nEngineering Project Management\nCompany Overview\nMing Hing Waterworks Engineering Co., Ltd is a premium integrated waterworks engineering, technology and investment company. The Group principally\n engages in the provision of project management services, maintenance and construction works for civil engineering projects on waterworks & drainage, roads & highways and slope upgrading services in Hong Kong. Founded in 1967, the Group has grown to establish\n itself as a major waterworks engineering service provider in Hong Kong, accountable for ensuring dependable water supply to the community.\n\n\n\nGiven increasing project work in Hong Kong and China, Ming Hing is inviting high calibre applicants for the following positions to join its present team of professionals.\nAdditional Company Information\nIndustry\nEngineering - Building, Civil, Construction / Quantity Survey\nBenefits & Others\nEducation allowance\n, \nMedical insurance\n, \nPerformance bonus", "page": 7, "job_url": "https://hk.jobsdb.com/hk/en/job/construction-manager-site-agent-works-manager-100003007943183?searchRequestToken=4400150d-e0e5-47dc-97f5-ce3586835c5c&sectionRank=183&jobId=100003007943183"}
{"jobname": "Land Surveyor", "comname": "Ming Hing Waterworks Engineering Co Ltd", "img": "https://content.jobsdbcdn.com/Content/CmsContent/Logo/HK/JobsDBFiles/CompanyLogo/1347.gif", "place": "Sheung Shui", "salary": "Salary negotiable", "posttime": "Posted on 29 Aug 2020", "job_detail": "Job Highlights\nPrepare and maintain the survey results\nCertificate or above in Land Surveying\n-\nJob Description\nDuties & Responsibilities:\n\n\n\n\nPrepare and maintain the survey results including data, charts, plots, map, records, etc;\n\n\nArrange general maintenance and calibration of survey instruments;\n\n\nPerform night duties if and when necessary to suit the site progress.\n\n\nPerform other ad hoc duties as assigned.\n\n\n\n\nRequirements:\n\n\n\n\nDegree/ Diploma holder in Land Surveying or equivalent;\n\n\nAt least 7 years post qualification working experience;\n\n\nGood command of spoken and written English and Cantonese;\n\n\nGood PC skills on MS Word, Excel and AutoCAD;\n\n\nImmediately available is highly preferred;\n\n\nLess experience candidates will be considerate as Assistant Surveyor.\n\n\n\n\nBenefit:\n\n\nWe offer good career prospects, 5/6-day work (Alt. Sat), training sponsorship allowance, medical allowance and intensive discretionary bonus to the right candidates.\n\n\n\n\nWorking Hour     :  Mon – Fri    08:00 – 18:00    Alt. Sat    08:00 – 18:00\n\n\nWork Location    :  Site Office (Sheung Shui)\n\n\nHoliday                :  Public Holiday\n\n\nAnnual Leave     :  10 days\n\n\nPaid Leave   : Birthday Leave/ Marriage Leave/ Maternity Leave/ Paternity Leave/ Compassionate Leave\n\n\n\n\nJob Application:\n\n\n\n\nPlease click \"Apply Now\" to submit your application.　\n\n\nApplication without expected salary will not be considered.\n\n\n\n\nPersonal Information Collection Statement:\n\n\n\n\nPersonal data provided to Ming Hing Waterworks group is solely for recruitment purposes. Your personal data may be transferred within the group for recruitment use only.\n\n\nMing Hing Waterworks group may disclose relevant data that applicants provided to the person(s) and organization(s) as stated for this recruitment purposes.\n\n\nTo update your personal data or to request for a copy after submission of job application form, please contact Human Resources Department at (852) 2380 8265 or e-mail by\n clicking \"Apply Now\".\n \n\n\nPersonal data collected will be used for recruitment purpose only.\nAdditional Information\nCareer Level\nMiddle\nQualification\nDegree\nYears of Experience\n7 years\nJob Type\nFull Time, Permanent\nJob Functions\nBuilding & Construction\n > \nCivil / Structural\n, \nEngineering\n > \nOthers\nCompany Overview\nMing Hing Waterworks Engineering Co., Ltd is a premium integrated waterworks engineering, technology and investment company. The Group principally\n engages in the provision of project management services, maintenance and construction works for civil engineering projects on waterworks & drainage, roads & highways and slope upgrading services in Hong Kong. Founded in 1967, the Group has grown to establish\n itself as a major waterworks engineering service provider in Hong Kong, accountable for ensuring dependable water supply to the community.\n\n\n\nGiven increasing project work in Hong Kong and China, Ming Hing is inviting high calibre applicants for the following positions to join its present team of professionals.\nAdditional Company Information\nIndustry\nEngineering - Building, Civil, Construction / Quantity Survey\nBenefits & Others\nEducation allowance\n, \nMedical insurance\n, \nPerformance bonus", "page": 7, "job_url": "https://hk.jobsdb.com/hk/en/job/land-surveyor-100003007943182?searchRequestToken=4400150d-e0e5-47dc-97f5-ce3586835c5c&sectionRank=184&jobId=100003007943182"}
{"jobname": "Senior Manager, Application Development", "comname": "Tahoe Life Insurance Company Limited", "img": "", "place": "Tai Koo", "salary": "Salary negotiable", "posttime": "Posted on 29 Aug 2020", "job_detail": "Job Highlights\nDegree in Information Technology, Computer Science\nPMP &/or LOMA &/or ANZII/ACII is preferable\nSolid experience in GI is preferable\nJob Description\nJob Purpose:\n\n\n\n- Manage Application Development team independently.\n\n- Manage IT project independently.\n\n- Manage the software vendors to support the business enhancements.\n\n- Monitor the project progress and other project communications.\n\n- Provide leadership, guidance and coaching to the team. \n\n- Coordinate with software vendors to ensure the quality of their service / products.\n\n- Lead the team to ensure the stabilization of all systems\n\n\nJob Responsibilities:\n\n\n\n- Manage all aspects of the application development process for business applications that support  the administrative or operational functions of the company or those needed to serve customers effectively\n\n- Manage project or team leaders, application development (programming) groups, database groups and user support groups\n\n- Perform code reviews in the appropriate technologies if required\n\n- Lead assigned projects or tasks, including design and code reviews\n\n- Analyze and define customer requirements\n\n- Design and develop software modules that meet customer requirements while upholding high standards, reliability, security, maintainability, and performance\n\n- Assist in defining applications technical architecture\n\n- Design complex software components\n\n- Participate in peer reviews for designs, code, and other work products\n\n- Perform software quality assurance, including all types of testing of database designs to confirm functionality and performance\n\n- Write technical documentation if required\n\n- Advise management on systems and process improvement\n\n- Enhance and maintain applications\n\n- May support multiple projects with competing deadlines\n\n- Participate with a team to carry out the full lifecycle of software development activities\n\n- Play a role in setting the architecture and design for applications\n\n- Manage direct reports in accordance with company policies in an equal manner that ensures confidentiality\n\n- Lead and mentor staff to improve skill set and career potential\n\n- Advise on employee promotions, transfers, and dismissalsPerform ad hoc projects as assigned by supervisor.\n\n\nJob Requirements:\n\n\n\n- Bachelor degree in Information Technology, Computer Science or equivalent. \n\n- PMP &/or LOMA &/or ANZII/ACII is also preferable.\n\n- Minimum 17 years working experience with at least 14 years’ relevant experience with life insurance applications exposure.\n\n- Solid experience in General Insurance is also preferable.\n\n- Solid large scale systems development experience in Oracle platform using Oracle Form, Java or PL/SQL and/or Client Server environment using PowerBuilder and Sybase.\n\n- Strong self-initiative and commitment to deliver high quality result\n\n- Strong organization, interpersonal, presentation, problem solving, team building, project management and communication skills\n\n- Excellent command of written and spoken English & Chinese \nAdditional Information\nCareer Level\nSenior\nQualification\nDegree\nYears of Experience\n17 years\nJob Type\nFull Time\nCompany Website\nhttp://www.tahoelife.com.hk\nJob Functions\nInsurance\n > \nOthers\nCompany Overview\nTahoe Life Insurance Company Limited is a wholly-owned subsidiary of Tahoe Investment Group Company Limited. Adhere to the aspiration of fulfilling\n social responsibility,  we endeavor to serve our customers with sincerity, creating a brilliant future for our customers and the enterprise.\n\n\nAs the core business of Tahoe Investment’s financial arm, we are dedicated to offering comprehensive wealth management and life planning services. \n We strive to be the leader in the high-end life insurance sector, taking care of our customers’ life cycles.\nAdditional Company Information\nIndustry\nInsurance / Pension Funding\nBenefits & Others\nFive-day work week\n, \nLife insurance\n, \nMedical insurance\n, \nPerformance bonus", "page": 7, "job_url": "https://hk.jobsdb.com/hk/en/job/senior-manager-application-development-100003007943181?searchRequestToken=4400150d-e0e5-47dc-97f5-ce3586835c5c&sectionRank=185&jobId=100003007943181"}
{"jobname": "Leasing Manager/ Senior Leasing Manager - Retail Complex", "comname": "Hillman Ross", "img": "http://content.jobsdbcdn.com/Content/CmsContent/Logo/HK/JobsDBFiles/CompanyLogo/logo-l/38216l.png", "place": "", "salary": "Salary negotiable", "posttime": "Posted on 29 Aug 2020", "job_detail": "Job Highlights\nSizable retail portfolio\nLeadership role\nLucrative remuneration package\nJob Description\nWe are representing a number of renowned developers which are pioneer with significant footprint in the region. With their imminent expansion in the headquarters, they are inviting committed and self-motivated leasing talents to join their expanding team.\n \n We are now seeking for \nSenior\n \nLeasing Manager/ Leasing Manager. \n \nRESPONSIBILITIES\n \nManage a full spectrum of leasing operations including tenancy administration, budget preparation, term negotiations etc\nPerform a full spectrum of leasing operations including, lease negotiation and renewal, documentation, tenancy liaison etc\nFormulate strategic tenancy and marketing plans for the portfolio to achieve the group business objectives\nConduct detailed market research and feasibility studies to identify business opportunities\nDevelop extensive industry network and business partnership\nClosely coordinate with other stakeholders and related departments handover of premises and upgrade works\nQUALIFICATIONS \nTertiary educated in Surveying, Business, Marketing, Property Managementor related discipline\nAt least 8 years of solid leasing management experiences in commercial and retail sector, preferably from developers\nSelf-initiated, proactive with strong business acumen\nExcellent negotiation skills will be a significant advantage\nExcellent communications and presentation skills is essential\n \n \nAPPLY FOR THIS JOB \n Interested candidate please \nCLICK\n apply button to apply online or send your resume in MS word format to Hillman Ross Recruitment Solution Professional \n \nPlease note that only shortlisted candidate will be notified. All information will be treated in strict confidence and solely used for recruitment purposes.\nAdditional Information\nCareer Level\nSenior\nQualification\nDegree\nYears of Experience\n5 years\nJob Type\nFull Time, Permanent\nJob Functions\nProperty / Real Estate\nCompany Overview\nHarnessing the Power of People\nHillman Ross's success is based on building long-lasting relationships with clients, candidates and employees every step of the way.\nWe believe that finding the best talent on the right terms is part of the bigger picture of helping our clients grow and position their businesses for the future.\nQuality candidates underpin our business and our reputation. We strive to see our candidates' careers flourish wherever opportunity leads and encourage them to return to us as a trusted source of career advice.\nAdditional Company Information\nIndustry\nHuman Resources Management / Consultancy", "page": 7, "job_url": "https://hk.jobsdb.com/hk/en/job/leasing-manager-senior-leasing-manager-retail-complex-100003007943179?searchRequestToken=4400150d-e0e5-47dc-97f5-ce3586835c5c&sectionRank=186&jobId=100003007943179"}
