{"jobname": " (逆市機會)《HR招募師》X 理財策劃行業 TOP Recruiter ", "comname": "ACT Company", "img": "http://content.jobsdbcdn.com/Content/CmsContent/Logo/HK/JobsDBFiles/CompanyLogo/logo-l/67684l.png", "place": "Kwun Tong", "salary": "HK$30,000 - HK$90,000 /month (includes high commission)", "posttime": "Posted on 29 Aug 2020", "job_detail": "Job Highlights\n歡迎敢搏、年輕、有活力的年輕人加入\n用心實踐專業，以愛成就人生\n時間自主，招募成就事業！\nJob Description\n# 與其幫公司老闆請人，不如幫自己請人？\n\n\n# 有沒有想過有一個行業是可以透過\"招募\"去長久持續發展？\n\n\nACT Company\n\n為宏利保險團隊\n，\n於2015年9月成立以來，快速成為宏利最有貢獻，最有價值的團隊。如果你熱心追求卓，對理財策劃行業充滿熱誠，請立即加入ACT \n理財策劃團隊，實現專業發展路向，成就理想前程。\n\n\n______________________________________________________________________________\n\n\n 《HR招募師》\nX 理財策劃行業 Top Recruiter \n \n\n\n全行獨有\n 管理獎金\n40%\n  of \n下線每單生意\n\n\n另享有底薪\nHKD 13,000／月  \n或過住月薪\n 80%  * \n\n\n另加\n\n50% \n佣金\n Commission  Rate \n/  \n每張單計\n\n\n平均月薪可達\n HKD 30\n,\n000 - 88\n,\n000\n\n或\n更多\n\n\n不設任何業績壓力\n\n\n______________________________________________________________________________\n\n\n一直以來行業商機處處，加上政府大力推動，三大最熱門商機\n1）\n自願性醫保\n \n2）\n扣稅年金 \n3）\n強積金半自由行 \n令我們的\n客源出現供不應求的情怳，一天與眾多客戶會面令同事感到吃力，顧此我們長遠也需要急增\n前線人手\n，\n為了令公司請人更有系統，以及培養更多人才，本公司現正招募 \n\n\n招募師 X 理財策劃行業 Financial Planning Recruiter \n特別歡迎同行招募或有經驗人士\n\n\n工作範疇：\n\n\n\n\n負責協助公司招募／請人／面試 \n協助隊員跟進每日進度 \n提供培訓，加強隊員銷售能力，產品知識 \n會有經理培訓課程提供 \n亦需要見客，為客戶提供理財產品服務 \n\n\n福利：\n\n\n\n\n底薪\nHKD$13\n,\n000 - 30\n,\n000 \n(視乎過住經驗）\n\n\n另享\n豐厚佣金，每月獎金及年尾花紅 \n不定時有應徵者提供，長遠建立被動收入 \n團隊有\nCold Market \n揾客系統作支援\n\n\n專屬全方位有效培訓 \n在職銷售及產品培訓 \n公平晉升制度 \n不設任何業績壓力 \n觀塘甲級商場寫字樓工作 \n地方寬躺，擁有舒適休息空間 \n時間自主\n，自我安排放假時間，不設大假日數 \n旅行獎賞，如達標者可以一年去一次亞洲與歐洲（機票＋酒店)\n \n\n\n\n\n要求：\n\n\n\n\n中五畢業及五科合格 \n有良好的人際關係，好動，有創意，愛與人交際 \n愛溝通，主動，敢於接受挑戰 \n經驗不拘，歡迎畢業大學生 \n\n\n\n*******\n有意者請立刻點擊\nApply Now\n以安排面試\n **********\nAdditional Information\nCareer Level\nMiddle\nQualification\nPostgraduate\nYears of Experience\nN/A\nJob Type\nContract, Freelance, Full Time, Internship, Part Time, Permanent, Temporary\nJob Functions\nAdmin & HR\n > \nAdministration / Operation Manager\n, \nAdmin & HR\n > \nHR Director / Manager\n, \nAdmin & HR\n > \nRecruitment / Executive Search\nCompany Overview\nACT Company 為\n宏利保險\n-理財策劃團隊，不同的人生階段都有不同理財需要。香港人平時生活忙碌，較少時間打理自己的理財需要，我們致力提供多元化的理財方案，專人一對一以用心專業的態度去服務每個客戶，讓客戶得到全面及放心的理財保障。客戶的財富是一點一滴累積的，我們確信坐言起行能令生活過得更美好， \n ACT - Action Change Things ，亦是名字的由來。\n\n\nhttps://www.manulife.com.hk/en/individual.html\nAdditional Company Information\nIndustry\nInsurance / Pension Funding\nBenefits & Others\nDental insurance\n, \nDouble pay\n, \nEducation allowance\n, \nFive-day work week\n, \nFlexible working hours\n, \nFree shuttle bus\n, \nGratuity\n, \nHousing allowance\n, \nLife insurance\n, \nMedical insurance\n, \nOvertime pay\n, \nPerformance bonus\n, \nTransportation allowance\n, \nTravel allowance\n, \nWork from home", "page": 8, "job_url": "https://hk.jobsdb.com/hk/en/job/hr%e5%b8%abx-%e7%90%86%e8%b2%a1%e7%ad%96%e5%8a%83%e8%a1%8c%e6%a5%ad-top-recruiter-100003007943119?searchRequestToken=29955114-fbc7-450d-916a-4a779d401249&sectionRank=234&jobId=100003007943119"}
{"jobname": "Accounting and Administrative Officer", "comname": "Company Confidential", "img": "", "place": "Central", "salary": "HK$17,000 - HK$25,000 /month (negotiable)", "posttime": "Posted on 29 Aug 2020", "job_detail": "Job Highlights\nExperienced accounting professional\nFull spectrum of office administrative work\nResponsible & willing to learn\nJob Description\nOverview:\n\n\n\n\n\n\nWe are a boutique family office based in Hong Kong with a progressive asset management philosophy across multi-asset classes. We are currently looking for an all-rounded Accounting and Administrative\n Officer to join our investment team. \nResponsibilities:\n\n\n\n\n\n\nPrepare weekly and monthly financial reports on investment portfolio and accounts\n\nLiaise with local and overseas parties, including financial institutes, accounting and legal professionals and other service providers\n\nEnsure smooth daily office operations, including payroll, billing, scheduling, drafting presentations, office supplies and services procurement, and other ad-hoc duties\n\n\n\n\nRequirements:\n\n\n\n\n\n\nAt least 3 years of experience in an accounting role, preferably in a fast-paced SME environment\n\nKnowledge in investment and LCCI qualification will be an advantage\n\n\nStrong sense of responsibility, excellent organizational skills, attention to details\n\n\n\n\n\n\nInterested candidates, please contact us at 23432229 for company details before applying.\nAdditional Information\nCareer Level\nMiddle\nQualification\nNon-Degree Tertiary\nYears of Experience\n3 years\nJob Type\nFull Time, Permanent\nJob Functions\nAccounting\n > \nAccountant\n, \nAccounting\n > \nAccounting Clerk / Supervisor\n, \nAdmin & HR\n > \nClerical / Admin Staff\nAdditional Company Information\nIndustry\nFinancial Services\nBenefits & Others\nFive-day work week\n, \nPerformance bonus", "page": 8, "job_url": "https://hk.jobsdb.com/hk/en/job/accounting-and-administrative-officer-100003007943117?searchRequestToken=29955114-fbc7-450d-916a-4a779d401249&sectionRank=235&jobId=100003007943117"}
{"jobname": "Project Manager", "comname": "Hai Yang Curtain Wall and Decoration Engineering Limited", "img": "", "place": "", "salary": "Salary provided", "posttime": "Posted on 29 Aug 2020", "job_detail": "Job Highlights\nProject Management\nDetailed \nResponsible \nJob Description\nResponsibilities\n\n\n\n• Monitor and control site progress\n\n\n\n• Measure project performance using appropriate methods and techniques which not limited to ensure safety, budgeting, quality and timeline are well met requirement and\n scheduled \n\n\n• Direct Report to managing director about the project progress and any potential project risks\n\n\n\n• Responsible for projects on a day to day basis, monitor overall progress and use of resources and to provide corrective reactions where necessary\n\n\n\n• Daily visit to the site, regular meeting with site agents / clients to deal with any rising issues or difficulties.\n\n\n• Supervise the Procurement Department, Drafting Department and Site Management Department and make sure that project progress within the schedule.\n\n\n• Outdoor work is required and work locations can be varied.\n\n\n\n\nRequirement\n\n\n• Diploma or above in interior design / building studies / architecture or equivalent is preferred (Candidates with strong experience will be also considered)\n\n\n\n• At least 2 years solid experience in alum. cladding , curtain wall ,steel frame , glass \nprojects\n\n\n• Strong technical background and site experience\n\n\n\n• Strong communication and interpersonal skills\n\n\n\n• Good computer software skills , including Word, Excel and CAD\nAdditional Information\nCareer Level\nMiddle\nQualification\n(N/A)\nYears of Experience\n2 years\nJob Type\nFull Time\nJob Functions\nBuilding & Construction\n > \nBuilding / Construction / QS\n, \nEngineering\n > \nEngineering Project Management\nCompany Overview\nHaiyang Curtain Wall and Decoration Engineering Limited is a growing company which is specialized in providing construction services of doors/windows, systems, decoration, curtain walls, metal works, architectural features for residents and commercial buildings\n in Hong Kong since 2009. If interested, please visit us at \nwww.hai-yang.com.hk \nAdditional Company Information\nIndustry\nEngineering - Others\nBenefits & Others\nFlexible working hours\n, \nPerformance bonus", "page": 8, "job_url": "https://hk.jobsdb.com/hk/en/job/project-manager-100003007943115?searchRequestToken=29955114-fbc7-450d-916a-4a779d401249&sectionRank=236&jobId=100003007943115"}
{"jobname": "Technical Director", "comname": "Hays", "img": "", "place": "", "salary": "HK$90,000 - HK$120,000 /month (negotiable)", "posttime": "Posted on 29 Aug 2020", "job_detail": "Job Highlights\nAssess & adjust quotations of damaged assets\nManage the P&L effectively\nKnowledge of general insurance and legal\nJob Description\nTo effectively lead a department for the processing and negotiation of claims.\n \n \nYour new company\n Located in Hong Kong, this insurance firm is famous for its development of innovative and highly effective loss adjusting services. With demand increasing, it is seeking to expand and grow a team of people who have a strong passion develop their career in loss adjusting.\n \n \nYour new role\n You'll manage a qualified team of loss adjusters with varying levels of experience. You'll be the key point of contact for your key stakeholders across Hong Kong. Reviewing and coordinating the workload across your team will be a constant in this position, as well as your ability to lead, develop and mentor a team.\n \n \nWhat you'll need to succeed\nA strong foundation within loss adjusting\nSignificant years of experience gained within the general insurance sector focusing on claims management and relationship/business development\nBachelor's Degree relating to Engineering, Accountancy, Finance, or the equivalent\nAppropriate industry professional certification, eg ACII, ANZIIF, ACILA\n \nWhat you'll get in return\nExcellent career support and leadership training\nInvolvement and ownership of projects in a growing industry\n \nWhat you need to do now\n If you're interested in this role, please forward an up-to-date copy of your CV to \n[email protected]\n, or call us now.\n If this job isn't quite right for you but you are looking for a new position, please contact us for a confidential discussion on your career.\nAdditional Information\nCareer Level\nSenior\nQualification\nDegree\nYears of Experience\nN/A\nJob Type\nFull Time, Permanent\nCompany Website\nhttp://hays.com.hk\nJob Functions\nInsurance\n, \nInsurance\n > \nClaims Officer\n, \nInsurance\n > \nUnderwriter\nCompany Overview\nAt Hays, we believe the right job can transform a person's life and the right person can transform a business. We're passionate about connecting our candidates with the right job for them.\nOperating across the private and public sectors, dealing in permanent positions, contract roles and temporary assignments, Hays placed 67,000 candidates into permanent jobs and around 220,000 into temporary assignments in the 2016 financial year. Our breadth and depth of expertise has enabled us to power the world of work for many decades.\nIn Hong Kong, our recruiting experts are available to you in the following specialisms:\nAccountancy & Finance\nBanking & Financial Services\nEngineering\nFinance Technology\nHuman Resources\nInformation Technology\nInsurance \nLegal \nLife Sciences \nProcurement\nSales & Marketing\nSupply Chain\nTo connect with a recruiting expert at Hays, visit us at www.hays.com.hk or follow Hays on LinkedIn - The #1 Recruiter on LinkedIn globally.\nAdditional Company Information\nIndustry\nInsurance / Pension Funding", "page": 8, "job_url": "https://hk.jobsdb.com/hk/en/job/technical-director-100003007943113?searchRequestToken=29955114-fbc7-450d-916a-4a779d401249&sectionRank=237&jobId=100003007943113"}
{"jobname": "Technical Manager - Commercial Laboratory", "comname": "ConnectedGroup Ltd", "img": "", "place": "", "salary": "Salary provided", "posttime": "Posted on 29 Aug 2020", "job_detail": "Job Highlights\nRenowned multinational company\nAttractive remuneration package\nHandling Technical Compliance File\nJob Description\nJob Description:\n Our client is a renowned multinational company. They are currently looking for a Technical Manager to join their expanding business in Hong Kong.\nKey Job Responsibilities include:\nResponsible for handling Technical compliance files.\nMaintain good relationship with existing and new clients\nProvide technical support to clients on consumer goods\nWork closely with internal parties and ensure the service meet client's requirement.\nAnalyze the client's requirements and align the service level.\nInvolve in improvement plan in order to optimized operation process\nSetting up KPI and SOP with the purpose of monitor the performance.\nOther requirements include\nMinimum of 5 years' experience in Quality Assurance / Commerical Laboratory or other related fields\nExperience in handling Technical Compliance Files is a must\nFamiliar with the safety regulations of consumer goods\nExcellent communication and customer-facing skills\nFluent in English and Mandarin, both written and spoken\nWilling to travel\nInterested parties please send your updated CV with current and expected salary to Wilfred.Fung @ connectedgroup.com\nAdditional Information\nCareer Level\nSenior\nQualification\nDegree\nYears of Experience\nN/A\nJob Type\nFull Time, Permanent\nCompany Website\nhttp://www.connectedgroup.com\nJob Functions\nSciences, Lab, R&D\n > \nLife Science\n, \nSciences, Lab, R&D\n, \nSciences, Lab, R&D\n > \nOthers\nCompany Overview\nConnectedGroup is an executive search and recruitment firm with offices in Hong Kong and China. We work across a number of industry sectors providing cross-functional recruitment. Our specialisms are Financial Services, Legal, Manufacturing, Supply Chain/Sourcing, Industrial, Technology, Strategy & Transformation, Life Sciences, Consumer and Retail/Luxury Goods, Hospitality, Sales, Marketing & Communications, Corporate Functions/Administration (Human Resources & Talent Acquisition/Finance/Accounting/Professional Support), Property & Real Estate.\nAll information is used for recruitment purposes only. Although we endeavour to respond to every applicant this may not always be possible so if you receive no response within 60 days, please consider your application for this specific vacancy to be unsuccessful. We will contact you with the next vacancy that matches your profile.\nhttp://www.connectedgroup.com/privacy-policy\nAdditional Company Information\nIndustry\nLaboratory", "page": 8, "job_url": "https://hk.jobsdb.com/hk/en/job/technical-manager-commercial-laboratory-100003007943112?searchRequestToken=29955114-fbc7-450d-916a-4a779d401249&sectionRank=238&jobId=100003007943112"}
{"jobname": "Safety Supervisor", "comname": "Randstad Hong Kong Limited", "img": "", "place": "", "salary": "Salary provided", "posttime": "Posted on 29 Aug 2020", "job_detail": "Job Highlights\nRelocation opportunity\nNew building development\nNew headcount\nJob Description\nSafety Supervisor| Contractor | Relocation\nRelocation opportunity\nNew building development\nCompetitive package\nNew headcount\n \nAbout the Company\nOur client company is a leading contractor originating in Hong Kong with over 50 years of experience. They have established a reputation of a reliable building contractor for quality and complex projects across the public and private sectors. As their company is expanding, they are now inviting a \nSafety Supervisor \nto join their team and help to improve their services.\n \nAbout the Role\n \n As a Safety Supervisor, you can expect your major responsibilities to be the followings:\nEnsure all works are carried out effectively and in a safe manner\nMonitor the safety or protection for on-site construction activities\nIdentify hazards on construction sites in avoiding potential accidents\nConduct investigation to workplace accident/incident\nEnsure compliance with the safety and environmental laws and regulations and client's specifications.\nDevelop internal safety communication strategy ensuring appropriate policies, procedures are in place\nConduct SIC (Safety Induction Course) for contractors, staff, and clients.\nDevelop an auditing and certification strategy to verify and validate the effectiveness of the safety programs.\n \n \nAbout the Requirement\nDiploma / Degree in Occupational Health & Safety or equivalent\nSolid Experience in conducting site inspections\nGood Knowledge of risk management strategies and processes\nOpen to relocation on a global level\nGood communication, interpersonal and project management skills\nFluency in spoken and written English and Chinese\n Interested parties please apply the job by clicking the appropriate link with your updated resume and salary details to \n[email protected]\n or contact Royce Chan by +852 2232 3477 We regret only shortlisted candidates will be contacted.\nAdditional Information\nCareer Level\nMiddle\nQualification\nDegree\nYears of Experience\nN/A\nJob Type\nFull Time, Permanent\nCompany Website\nhttp://www.randstad.com.hk\nJob Functions\nBuilding & Construction\n, \nBuilding & Construction\n > \nBuilding / Construction / QS\n, \nBuilding & Construction\n > \nOthers\nCompany Overview\nRandstad is a global leader in the HR services industry, with Asia-Pacific operations in Singapore, Malaysia, Hong Kong, China, Australia and New Zealand. Our Hong Kong operations has been supporting people and organisations in realising their true potential, helping find the best permanent and contracting talent in accounting & finance, banking & financial services, business support, construction & property, engineering, human resources, technologies, sales, marketing & communications and supply chain & procurement.\nHuman connection is at the heart of our business. Our personal approach, supported by state-of-the-art technology, is what sets us apart in the world of work. We express this with a new brand promise: Human Forward.\nAdditional Company Information\nIndustry\nArchitecture / Building / Construction", "page": 8, "job_url": "https://hk.jobsdb.com/hk/en/job/safety-supervisor-100003007943110?searchRequestToken=29955114-fbc7-450d-916a-4a779d401249&sectionRank=239&jobId=100003007943110"}
{"jobname": "Assistant Accountant, FP&A - International Engineering Co.", "comname": "ConnectedGroup Ltd", "img": "", "place": "", "salary": "HK$20,000 - HK$30,000 /month (negotiable)", "posttime": "Posted on 29 Aug 2020", "job_detail": "Job Highlights\nLeading Engineering Group, APAC\nRemarkable Career Development\n14 Months Salary\nJob Description\nFinancial Analyst - International Engineering Co. \nFinancial Analyst - International Engineering Co\n.\nOur client is the Asian leading Engineering Firm based in Hong Kong for years. With their expansion in Hong Kong, Macau, Taiwan, and PRC markets, they have participated in a great number of joint government & international construction projects. To provide the company with the most accurate and insightful strategy, the position of a Financial Analyst is currently open for application.\nLocation: HK Island\nSalary: HK$20,000 - HK26,000 X 12 months + Bonus (Half-year & Year-end) + Allowance \nResponsibilities:\nResponsible for handling daily accounting matters, month-end closing & internal control\nClose liaison with business units and other departments on budget, forecast and cost control\nPrepare management reports, schedules, reconciliation & perform financial analysis\nWork with business units on Budget / Forecast and track performance with variance analysis on a timely basis\nAd hoc tasks as assigned\nQualifications:\nDegree in Accountancy, Finance or similar discipline, Qualified accountant\nMinimum 4 years of relevant experience with background in construction / engineering industry preferred\nProficiency in Microsoft office and applications; well versed in Excel, VBA knowledge/ experience highly preferred\nKnowledge in ERP and experience in Microsoft AX is an advantage\nProficient in both written and spoken English and Chinese\nExcellent communication skills, able to work and interface well with personnel at various levels\nProactive, independent, committed and with strong sense of responsibility to meet tight deadlines\nCandidates with more experience can be considered as Accountant\nInterested individuals can apply now and send CV to Roy Chui or call +852 3972 6552 for further information. Only relevant candidates will be contacted.\nFor a complete list of our vacancies, please visit: www.connectedgroup.com\nAdditional Information\nCareer Level\nMiddle\nQualification\nDegree\nYears of Experience\nN/A\nJob Type\nFull Time, Permanent\nCompany Website\nhttp://www.connectedgroup.com\nJob Functions\nAccounting\n, \nAccounting\n > \nAccountant\n, \nAccounting\n > \nAccounting Clerk / Supervisor\nCompany Overview\nConnectedGroup is an executive search and recruitment firm with offices in Hong Kong and China. We work across a number of industry sectors providing cross-functional recruitment. Our specialisms are Financial Services, Legal, Manufacturing, Supply Chain/Sourcing, Industrial, Technology, Strategy & Transformation, Life Sciences, Consumer and Retail/Luxury Goods, Hospitality, Sales, Marketing & Communications, Corporate Functions/Administration (Human Resources & Talent Acquisition/Finance/Accounting/Professional Support), Property & Real Estate.\nAll information is used for recruitment purposes only. Although we endeavour to respond to every applicant this may not always be possible so if you receive no response within 60 days, please consider your application for this specific vacancy to be unsuccessful. We will contact you with the next vacancy that matches your profile.\nhttp://www.connectedgroup.com/privacy-policy\nAdditional Company Information\nIndustry\nEngineering - Electrical / Electronic / Mechanical", "page": 8, "job_url": "https://hk.jobsdb.com/hk/en/job/assistant-accountant-financial-planning-and-analysis-international-engineering-co-100003007943109?searchRequestToken=29955114-fbc7-450d-916a-4a779d401249&sectionRank=240&jobId=100003007943109"}
